Departamento,Epigrafe,Item_Nombre,Item_URL_XML,Seccion,Alertas,Fecha_publicacion,Item_Name,Materias,Referencias,Referencias_palabra,Referencias_texto,Referencias_completas,Tags,Match_ASECORP_BBDD
['JEFATURA DEL ESTADO'],['Agricultura. Alimentación'],"['Corrección de errores de la Ley 8/2020, de 16 de diciembre, por la que se adoptan determinadas medidas urgentes en materia de agricultura y alimentación.']",https://www.boe.es/diario_boe/xml.php?id=BOE-A-2021-1528,['I. Disposiciones generales'],"['Agricultura', 'Comercio', 'Derecho Administrativo', 'Derecho Mercantil', 'Ganadería y animales', 'Seguridad Social', 'Sistema tributario', 'Trabajo y empleo']",2021-02-03,"['Corrección de errores de la Ley 8/2020, de 16 de diciembre, por la que se adoptan determinadas medidas urgentes en materia de agricultura y alimentación.']","['Agricultura', 'Ayudas', 'Contratos de trabajo', 'Cotización a la Seguridad Social', 'Ganadería', 'Producción alimentaria', 'Régimen Especial Agrario de la Seguridad Social', 'Trabajadores']",['BOE-A-2020-16346'],['CORRECCIÓN de errores'],"['de la Ley 8/2020, de 16 de diciembre']","['CORRECCIÓN de errores de la Ley 8/2020, de 16 de diciembre']",['Ley 8/2020'],['LEY 8/2020 ESP']
['JEFATURA DEL ESTADO'],['Medidas urgentes'],"['Real Decreto-ley 3/2021, de 2 de febrero, por el que se adoptan medidas para la reducción de la brecha de género y otras materias en los ámbitos de la Seguridad Social y económico.']",https://www.boe.es/diario_boe/xml.php?id=BOE-A-2021-1529,['I. Disposiciones generales'],"['Asuntos sociales', 'Derecho Administrativo', 'Organización de la Administración', 'Sanidad', 'Seguridad Social', 'Sistema financiero', 'Trabajo y empleo']",2021-02-03,"['Real Decreto-ley 3/2021, de 2 de febrero, por el que se adoptan medidas para la reducción de la brecha de género y otras materias en los ámbitos de la Seguridad Social y económico.']","['Accidentes de trabajo y enfermedades profesionales', 'Asistencia social', 'Ayudas', 'Clases Pasivas', 'Cotización a la Seguridad Social', 'Familia', 'Hipoteca', 'Igualdad de género', 'Instituto de Crédito Oficial', 'Jubilación', 'Mujer', 'Organizaciones No Gubernamentales', 'Pensiones', 'Personal Sanitario de la Seguridad Social', 'Préstamos', 'Procedimiento administrativo', 'Registros administrativos', 'Renta Mínima de Inserción', 'Secretaría General de Objetivos y Políticas de Inclusión y Previsión Social', 'Seguridad Social', 'Trabajadores', 'Trabajadores autónomos']","['BOE-A-2021-1130', 'BOE-A-2020-5493', 'BOE-A-2015-11724', 'BOE-A-1987-12636', 'BOE-A-2020-12898']","['MODIFICA', 'MODIFICA', 'MODIFICA', 'MODIFICA', 'DE CONFORMIDAD con']","['los arts. 5.9, 7.5.2 y la disposición transitoria 2 del Real Decreto-ley 2/2021, de 26 de enero', 'los arts. 4 a 6, 14.1, 19, 25.3, 30.2, 31.2 y AÑADE los arts. 6 bis a 6 quater, 19 bis, 33 bis y la disposición transitoria 8 al Real Decreto-ley 20/2020, de 29 de mayo', 'el art. 60 y AÑADE las disposiciónes adicionales 36, 37 y transitoria 33 a la Ley General de la Seguridad Social, texto refundido aprobado por el Real Decreto legislativo 8/2015, de 30 de octubre', 'la disposición adicional 18 y AÑADE la disposición transitoria 14 a la Ley de Clases Pasivas del Estado, texto refundido aprobado por el Real Decreto legislativo 670/1987, de 30 de abril', 'el art. 2 del  Real Decreto 926/2020, de 25 de octubre']","['MODIFICA los arts. 5.9, 7.5.2 y la disposición transitoria 2 del Real Decreto-ley 2/2021, de 26 de enero', 'MODIFICA los arts. 4 a 6, 14.1, 19, 25.3, 30.2, 31.2 y AÑADE los arts. 6 bis a 6 quater, 19 bis, 33 bis y la disposición transitoria 8 al Real Decreto-ley 20/2020, de 29 de mayo', 'MODIFICA el art. 60 y AÑADE las disposiciónes adicionales 36, 37 y transitoria 33 a la Ley General de la Seguridad Social, texto refundido aprobado por el Real Decreto legislativo 8/2015, de 30 de octubre', 'MODIFICA la disposición adicional 18 y AÑADE la disposición transitoria 14 a la Ley de Clases Pasivas del Estado, texto refundido aprobado por el Real Decreto legislativo 670/1987, de 30 de abril', 'DE CONFORMIDAD con el art. 2 del  Real Decreto 926/2020, de 25 de octubre']","['Real Decreto-ley 2/2021', 'Real Decreto-ley 20/2020', 'Real Decreto legislativo 8/2015', 'Real Decreto legislativo 670/1987', 'Real Decreto 926/2020']",[]
['TRIBUNAL CONSTITUCIONAL'],['Recursos de inconstitucionalidad'],"['Recurso de inconstitucionalidad n.º 6289-2020, contra los artículos 2, 3.2, 3.3, 3.4, 6, 7.1, 15.1, 16.2 y 18 y disposiciones adicionales primera y cuarta de la Ley de Cataluña 11/2020, de 18 de septiembre, de medidas urgentes en materia de contención de rentas en los contratos de arrendamiento de vivienda y de modificación de la Ley 18/2007, de la Ley 24/2015 y de la Ley 4/2016, relativas a la protección del derecho a la vivienda.']",https://www.boe.es/diario_boe/xml.php?id=BOE-A-2021-1530,['I. Disposiciones generales'],"['Asuntos sociales', 'Derecho Administrativo', 'Vivienda y urbanismo']",2021-02-03,"['Recurso de inconstitucionalidad n.º 6289-2020, contra los artículos 2, 3.2, 3.3, 3.4, 6, 7.1, 15.1, 16.2 y 18 y disposiciones adicionales primera y cuarta de la Ley de Cataluña 11/2020, de 18 de septiembre, de medidas urgentes en materia de contención de rentas en los contratos de arrendamiento de vivienda y de modificación de la Ley 18/2007, de la Ley 24/2015 y de la Ley 4/2016, relativas a la protección del derecho a la vivienda.']","['Arrendamientos urbanos', 'Asistencia social', 'Cataluña', 'Contratos', 'Precios', 'Procedimiento sancionador', 'Recursos de inconstitucionalidad', 'Viviendas']","['BOE-A-2020-11363', 'BOE-A-2017-522', 'BOE-A-2008-3657']","['Recurso promovido contra', 'Recurso promovido contra', 'Recurso promovido contra']","['determinados preceptos de la Ley 11/2020, de 18 de septiembre', 'el art. 16 de la Ley 4/2016, de 23 de diciembre', 'los arts. 124.4 y 125.2 de la Ley 18/2007, de 28 de diciembre']","['Recurso promovido contra determinados preceptos de la Ley 11/2020, de 18 de septiembre', 'Recurso promovido contra el art. 16 de la Ley 4/2016, de 23 de diciembre', 'Recurso promovido contra los arts. 124.4 y 125.2 de la Ley 18/2007, de 28 de diciembre']","['Ley 11/2020', 'Ley 4/2016', 'Ley 18/2007']",['LEY 11/2020 ESP']
"['MINISTERIO DE LA PRESIDENCIA, RELACIONES CON LAS CORTES Y MEMORIA DEMOCRÁTICA']",['Medidas excepcionales'],"['Orden PCM/79/2021, de 2 de febrero, por la que se publica el Acuerdo del Consejo de Ministros de 2 de febrero de 2021, por el que se establecen medidas excepcionales para limitar la propagación y el contagio por el COVID-19, mediante la limitación de los vuelos entre la República Federativa de Brasil y la República de Sudáfrica y los aeropuertos españoles.']",https://www.boe.es/diario_boe/xml.php?id=BOE-A-2021-1531,['I. Disposiciones generales'],"['Sanidad', 'Seguridad y Defensa', 'Transportes y tráfico']",2021-02-03,"['Orden PCM/79/2021, de 2 de febrero, por la que se publica el Acuerdo del Consejo de Ministros de 2 de febrero de 2021, por el que se establecen medidas excepcionales para limitar la propagación y el contagio por el COVID-19, mediante la limitación de los vuelos entre la República Federativa de Brasil y la República de Sudáfrica y los aeropuertos españoles.']","['Aeropuertos y aeródromos', 'Andorra', 'Brasil', 'Epidemias', 'Libre circulación de personas', 'Sanidad', 'Sudáfrica', 'Transporte de viajeros', 'Transportes aéreos']","['BOE-A-2020-12898', 'BOE-A-2020-8099', 'BOE-A-2020-16821']","['DE CONFORMIDAD con', 'EN RELACIÓN con', 'CITA']","['Real Decreto 926/2020, de 25 de octubre', 'la Orden INT/657/2020, de 17 de julio', 'Orden INT/1236/2020, de 22 de diciembre']","['DE CONFORMIDAD con Real Decreto 926/2020, de 25 de octubre', 'EN RELACIÓN con la Orden INT/657/2020, de 17 de julio', 'CITA Orden INT/1236/2020, de 22 de diciembre']","['Real Decreto 926/2020', 'Orden INT/657/2020', 'Orden INT/1236/2020']",[]
['MINISTERIO DE POLÍTICA TERRITORIAL Y FUNCIÓN PÚBLICA'],['Organización'],"['Real Decreto 57/2021, de 2 de febrero, por el que se suprime la Oficina Consular, con categoría de Consulado General de España, en Washington D.C., en los Estados Unidos de América, y se sustituye por una Sección Consular de la Embajada de España en Washington D.C.']",https://www.boe.es/diario_boe/xml.php?id=BOE-A-2021-1532,['I. Disposiciones generales'],"['Organización de la Administración', 'Relaciones internacionales']",2021-02-03,"['Real Decreto 57/2021, de 2 de febrero, por el que se suprime la Oficina Consular, con categoría de Consulado General de España, en Washington D.C., en los Estados Unidos de América, y se sustituye por una Sección Consular de la Embajada de España en Washington D.C.']","['Consulados', 'Estados Unidos de América', 'Relaciones Consulares']",['BOE-A-2014-3248'],['DE CONFORMIDAD con'],"['el art. 47.2 de la Ley 2/2014, de 25 de marzo']","['DE CONFORMIDAD con el art. 47.2 de la Ley 2/2014, de 25 de marzo']",['Ley 2/2014'],[]
['MINISTERIO DE POLÍTICA TERRITORIAL Y FUNCIÓN PÚBLICA'],['Organización'],"['Real Decreto 58/2021, de 2 de febrero, por el que se suprime la Oficina Consular, con categoría de Consulado General de España, en Génova, en la República Italiana.']",https://www.boe.es/diario_boe/xml.php?id=BOE-A-2021-1533,['I. Disposiciones generales'],"['Organización de la Administración', 'Relaciones internacionales']",2021-02-03,"['Real Decreto 58/2021, de 2 de febrero, por el que se suprime la Oficina Consular, con categoría de Consulado General de España, en Génova, en la República Italiana.']","['Consulados', 'Italia', 'Relaciones Consulares']",['BOE-A-2014-3248'],['DE CONFORMIDAD con'],"['el art. 47.2 de la Ley 2/2014, de 25 de marzo']","['DE CONFORMIDAD con el art. 47.2 de la Ley 2/2014, de 25 de marzo']",['Ley 2/2014'],[]
['MINISTERIO DE POLÍTICA TERRITORIAL Y FUNCIÓN PÚBLICA'],['Organización'],"['Real Decreto 59/2021, de 2 de febrero, por el que se suprime la Oficina Consular, con categoría de Consulado General de España, en Cartagena de Indias, en la República de Colombia.']",https://www.boe.es/diario_boe/xml.php?id=BOE-A-2021-1534,['I. Disposiciones generales'],"['Organización de la Administración', 'Relaciones internacionales']",2021-02-03,"['Real Decreto 59/2021, de 2 de febrero, por el que se suprime la Oficina Consular, con categoría de Consulado General de España, en Cartagena de Indias, en la República de Colombia.']","['Colombia', 'Consulados', 'Relaciones Consulares']",['BOE-A-2014-3248'],['DE CONFORMIDAD con'],"['el art. 47.2 de la Ley 2/2014, de 25 de marzo']","['DE CONFORMIDAD con el art. 47.2 de la Ley 2/2014, de 25 de marzo']",['Ley 2/2014'],[]
['MINISTERIO DE POLÍTICA TERRITORIAL Y FUNCIÓN PÚBLICA'],['Organización'],"['Real Decreto 60/2021, de 2 de febrero, por el que se suprime la Oficina Consular, con categoría de Consulado General de España, en Alejandría, en la República Árabe de Egipto.']",https://www.boe.es/diario_boe/xml.php?id=BOE-A-2021-1535,['I. Disposiciones generales'],"['Organización de la Administración', 'Relaciones internacionales']",2021-02-03,"['Real Decreto 60/2021, de 2 de febrero, por el que se suprime la Oficina Consular, con categoría de Consulado General de España, en Alejandría, en la República Árabe de Egipto.']","['Consulados', 'Egipto', 'Relaciones Consulares']",['BOE-A-2014-3248'],['DE CONFORMIDAD con'],"['el art. 47.2 de la Ley 2/2014, de 25 de marzo']","['DE CONFORMIDAD con el art. 47.2 de la Ley 2/2014, de 25 de marzo']",['Ley 2/2014'],[]
