Item_id,Item_Name,Fecha_publicacion,Materias,Alertas,Referencias,Referencias_completas,Tags,Match_ASECORP_BBDD
"=HIPERVINCULO(""https://www.boe.es/boe/dias/2021/02/15/pdfs/BOE-A-2021-2169.pdf"";""BOE-A-2021-2169"")","Corrección de errores de la Ley 18/2020, de 28 de diciembre, de facilitación de la actividad económica.",2021-02-15,"Actividades económicas, Administraciones Públicas, Ayudas, Cataluña, Organización de las Comunidades Autónomas, Política económica, Procedimiento administrativo","Derecho Administrativo, Organización de la Administración",,,,
"=HIPERVINCULO(""https://www.boe.es/boe/dias/2021/02/15/pdfs/BOE-A-2021-2168.pdf"";""BOE-A-2021-2168"")","Orden CUD/123/2021, de 9 de febrero, por la que se establece la obligatoriedad de comunicaciones y notificaciones por medios electrónicos en el procedimiento de concesión de las ayudas para la modernización e innovación de las industrias culturales y creativas mediante proyectos digitales y tecnológicos.",2021-02-15,,,,,,
"=HIPERVINCULO(""https://www.boe.es/boe/dias/2021/02/15/pdfs/BOE-A-2021-2166.pdf"";""BOE-A-2021-2166"")","Resolución de 8 de febrero de 2021, de la Dirección General de Política Energética y Minas, por la que se publican los nuevos precios de venta, antes de impuestos, de los gases licuados del petróleo por canalización.",2021-02-15,"Gas, Precios, Productos petrolíferos",Energía,,,,
"=HIPERVINCULO(""https://www.boe.es/boe/dias/2021/02/15/pdfs/BOE-A-2021-2167.pdf"";""BOE-A-2021-2167"")","Orden CUD/122/2021, de 9 de febrero, por la que se determina la composición y funciones de la Comisión Administradora del Fondo de Ayuda a las Bellas Artes.",2021-02-15,"Comisiones de Control y Seguimiento, Ministerio de Cultura y Deporte, Organización de la Administración del Estado, Órganos colegiados",Organización de la Administración,,,,
"=HIPERVINCULO(""https://www.boe.es/boe/dias/2021/02/15/pdfs/BOE-A-2021-2171.pdf"";""BOE-A-2021-2171"")","Decreto-ley 15/2020, de 21 de diciembre, de modificación del Decreto-ley 11/2020, de 10 de julio, por el que se establece un régimen sancionador específico para afrontar los incumplimientos de las disposiciones dictadas para paliar los efectos de la crisis ocasionada por la COVID-19.",2021-02-15,"Baleares, Enfermedades, Epidemias, Procedimiento sancionador, Sanidad","Derecho Administrativo, Sanidad","BOE-A-2020-9942, BOE-A-2007-4233, BOE-A-2020-12898, BOE-A-2020-5895","MODIFICA los arts. 3 y 4 del Decreto-ley 11/2020, de 10 de julio, DE CONFORMIDAD con el Estatuto aprobado por Ley Orgánica 1/2007, de 28 de febrero, CITA Real Decreto 926/2020, de 25 de octubre, CITA Real Decreto-ley 21/2020, de 9 de junio","ley 11/2020, Real Decreto 926/2020, Real Decreto-ley 21/2020",RDL 21/2020 ESP
"=HIPERVINCULO(""https://www.boe.es/boe/dias/2021/02/15/pdfs/BOE-A-2021-2170.pdf"";""BOE-A-2021-2170"")","Corrección de errores de la Ley 3/2020, de 30 de diciembre, de Presupuestos Generales para 2021.",2021-02-15,"Asturias, Juego, Presupuestos de las Comunidades Autónomas, Tasas","Sistema financiero, Sistema tributario",,,,
